{
  "event_id": "01JXYZRAW0000000000000001",
  "tenant_id": "tenant-opaque",
  "device_sn": "device-go2-0001",
  "component_hint": "joint_motor.front_left_hip",
  "occurred_at": "2026-08-13T10:00:00.123Z",
  "received_at": "2026-08-13T10:00:00.381Z",
  "sequence": 938821,
  "vendor": "vendor-a",
  "model": "motor-x2",
  "firmware": "3.2.1",
  "protocol_version": "motor-log-v2",
  "encoding": "utf-8",
  "payload_ref": "rawlog://opaque-ref-0001",
  "payload_digest": "sha256:0000000000000000000000000000000000000000000000000000000000000001"
}
